<?xml version="1.0" encoding="UTF-8"?>
<cgmm-properties xmlns:xsi="http://www.w3.org/2001/XMLSchema-instance" xsi:noNamespaceSchemaLocation="cgmm-properties.xsd">
	<cgmm-information>
		<cgmm-context-name>cgmmweb</cgmm-context-name>
		<cgmm-login-config-file-name>cgmm.login.config</cgmm-login-config-file-name>
		<start-auto-syncgts>true</start-auto-syncgts>
		<cgmm-new-grid-user-creation-disabled>false</cgmm-new-grid-user-creation-disabled>
		<cgmm-new-grid-user-creation-host-redirect-uri>/public/newGridUserCreation.jsp</cgmm-new-grid-user-creation-host-redirect-uri>
	</cgmm-information>
	<host-application-information>
		<host-context-name>cgmmhostweb</host-context-name>
		<host-application-name-for-csm>sampleHostApplicationContextName</host-application-name-for-csm>
		<host-public-home-page-url>/public/publicHome.jsp</host-public-home-page-url>
		<host-user-home-page-url>/secured/userHomePage.jsp</host-user-home-page-url>		
		<host-new-local-user-creation-url>/public/newLocalUserCreation.jsp</host-new-local-user-creation-url>
	</host-application-information>
	<authentication-service-list>
		<authentication-service-information>
			<service-name>caGrid Training</service-name>
			<service-url>https://dorian.training.cagrid.org:8443/wsrf/services/cagrid/Dorian</service-url>
			<dorian-information>
				<service-url>https://dorian.training.cagrid.org:8443/wsrf/services/cagrid/Dorian</service-url>
				<proxy-lifetime-hours>12</proxy-lifetime-hours>
				<proxy-lifetime-minutes>0</proxy-lifetime-minutes>
				<proxy-lifetime-seconds>0</proxy-lifetime-seconds>
				<proxy-delegation-path-length>3</proxy-delegation-path-length>
			</dorian-information>
		</authentication-service-information>
	</authentication-service-list>
</cgmm-properties>
